202053,BB2020530139,長野県飯田市,大名行列,ダイミョウギョウレツ,,,市指定無形文化財,,,202053,103003,長野県飯田市本町三丁目,長野県,飯田市,本町３丁目,,,,,,,,,,,,3950044,1,式,,,1968-11-19,,,,,,,大宮神社の式年祭に演じられ、江戸時代の大名行列の所作をよく伝承している。,,,,https://www.city.iida.lg.jp/site/bunkazai/shiteijoukyou.html,
202053,BB2020530140,長野県飯田市,今田人形芝居,イマダニンギョウシバイ,,,市指定無形文化財,,,202053,,長野県飯田市龍江,長野県,飯田市,龍江,,,35.451733,137.824009,,,,,,,,,1,式,,今田人形座,1990-11-14,,,,,,,三人遣いの人形浄瑠璃で、宝永元年（1704）より伝わるとされる。,,,,https://www.city.iida.lg.jp/site/bunkazai/shiteijoukyou.html,
202053,BB2020530141,長野県飯田市,黒田人形芝居,クロダニンギョウシバイ,,,市指定無形文化財,,,202053,,長野県飯田市上郷黒田,長野県,飯田市,上郷黒田,,,35.531625,137.837907,,,,,,,,,1,式,,黒田人形保存会,1994-02-18,,,,,,,三人遣いの人形浄瑠璃で、元禄年間(1688～1704)より伝わるといわれる。人形の操法に手と呼ばれる古い型を伝える。,,,,https://www.city.iida.lg.jp/site/bunkazai/shiteijoukyou.html,
202053,BB2020530142,長野県飯田市,操人形「老女形の首」,アヤツリニンギョウ「フケオヤマノカシラ」,,,市指定民俗文化財,その他,,202053,,長野県飯田市上郷黒田,長野県,飯田市,上郷黒田,,,35.531965,137.837796,,,,,,,,,1,個,,黒田人形保存会,1994-02-18,,,,,,,元文2年(1737)作で、製作年の判明する操人形首としては国内最古のものである。,,,,https://www.city.iida.lg.jp/site/bunkazai/shiteijoukyou.html,
202053,BB2020530143,長野県飯田市,天竜川の舟下り,テンリュウガワノフナクダリ,,,市指定民俗文化財,その他,,202053,,長野県飯田市松尾新井7170/長野県飯田市龍江7115-1,長野県,飯田市,松尾新井/龍江,7170/7115-1,,,,,,,,,,,,1,式,,,2016-07-14,,,,,,,およそ100年の歴史を有する観光川下り舟で、全国で6番目に古い。現在、天竜川水系で唯一の木造船の造船技術、操船技術が伝えられている。,,,,https://www.city.iida.lg.jp/site/bunkazai/shiteijoukyou.html,
202053,BB2020530144,長野県飯田市,ことの神送り,コトノカミオクリ,,,市指定民俗文化財,その他,,202053,,長野県飯田市上村上町,長野県,飯田市,上村上町,,,35.385007,137.968459,,,,,,,,,1,式,,,1998-11-27,,,,,,,2月8日前後の日曜に行われる。禰宜や村人が太鼓や鉦の囃子に合わせて謡い、悪疫を村から外に追い出す。,,,,https://www.city.iida.lg.jp/site/bunkazai/shiteijoukyou.html,
202053,BB2020530145,長野県飯田市,御祝棒 ,ゴイワイボウ ,,,市指定民俗文化財,その他,,202053,,長野県飯田市上村上町,長野県,飯田市,上村上町,,,35.387079,137.969674,,,,,,,,,1,式,,,1998-11-27,,,,,,,前年に結婚した夫婦の家へ子どもたちが訪れ、子孫繁栄・五穀豊穣を願い、男性を象った棒で縁側を叩いて祝う。,,,,https://www.city.iida.lg.jp/site/bunkazai/shiteijoukyou.html,
202053,BB2020530146,長野県飯田市,正調「絵島」,セイチョウ「エジマ」,,,市指定民俗文化財,その他,,202053,,長野県飯田市上村,長野県,飯田市,上村,,,,,,,,,,,,,1,式,,,1998-11-27,,,,,,,江戸で流行した絵島節が、高遠から伝えられ、秋葉街道の宿々で唄い継がれたが、現在では上村にのみ盆踊り唄として残る。,,,,https://www.city.iida.lg.jp/site/bunkazai/shiteijoukyou.html,
202053,BB2020530147,長野県飯田市,下栗掛踊り,シモグリカケオドリ,,,市指定民俗文化財,その他,,202053,,長野県飯田市上村下栗,長野県,飯田市,上村下栗,,,35.374819,137.986179,,,,,,,,,1,式,,,1998-11-27,,,,,,,8月15日の午後に行なわれる、はやしと唄にあわせて踊る雨乞い踊りと念仏踊りで、370年ほど前から伝わるといわれている。,,,,https://www.city.iida.lg.jp/site/bunkazai/shiteijoukyou.html,
202053,BB2020530148,長野県飯田市,中郷獅子舞,ナカゴウシシマイ,,,市指定民俗文化財,その他,,202053,,長野県飯田市上村中郷,長野県,飯田市,上村中郷,,,,,,,,,,,,,1,式,,,1998-11-27,,,,,,,悪疫・飢饉・その他の災害を逃れ、その年の安泰を祈願するために、獅子の太神楽舞を氏神様に奉納する。,,,,https://www.city.iida.lg.jp/site/bunkazai/shiteijoukyou.html,
202053,BB2020530149,長野県飯田市,此田神楽,コノタカグラ,,,市指定民俗文化財,その他,,202053,,長野県飯田市南信濃八重河内,長野県,飯田市,南信濃八重河内,,,35.314542,137.923469,,,,,,,,,1,式,,,1999-12-22,,,,,,,約280年前愛知県新城から伝えられたといわれる、伊勢神楽の流れをくむ獅子神楽である。,,,,https://www.city.iida.lg.jp/site/bunkazai/shiteijoukyou.html,
202053,BB2020530150,長野県飯田市,観耕亭碑,カンコウテイヒ,,,市指定史跡,,長姫神社境内,202053,11002,長野県飯田市追手町二丁目641,長野県,飯田市,追手町２丁目,641,,35.511727,137.832537,,,,,,,,3950034,1,基,,長姫神社,1968-11-19,,,,,,,石碑の撰文は安積信、書は高橋豊桂が担当し、安政6年(1859)に建てられた。飯田藩主の徳を讃えるもので、内容・筆跡ともに優れている。,,,,https://www.city.iida.lg.jp/site/bunkazai/shiteijoukyou.html,
202053,BB2020530151,長野県飯田市,日樹上人墓,ニチジュショウニンハカ,,,市指定史跡,,元山白山神社境内,202053,95000,長野県飯田市羽場権現1190-9,長野県,飯田市,羽場権現,1190-9,,35.518936,137.801853,,,,,,,,3950067,1,基,,個人,1968-11-19,,,,,,,五輪石塔で、寛永20年(1643)の日樹上人13回忌に仰円院日利により建立された。,,,,https://www.city.iida.lg.jp/site/bunkazai/shiteijoukyou.html,
202053,BB2020530152,長野県飯田市,飯田藩主堀家の墓所,イイダハンシュホリケノボショ,,,市指定史跡,,長久寺,202053,56000,長野県飯田市諏訪町4166,長野県,飯田市,諏訪町,4166,,35.525209,137.826929,,,,,,,,3950018,1,区画,,長久寺,1971-03-15,,,,,,,飯田藩6代藩主堀親蔵、9代親民、11代親義3基の笠塔婆のほか、藩主の妻や一族の墓がある。,,,,https://www.city.iida.lg.jp/site/bunkazai/shiteijoukyou.html,
202053,BB2020530153,長野県飯田市,神の峰城跡,カンノミネジョウアト,,,市指定史跡,,,202053,,長野県飯田市上久堅8166-3他,長野県,飯田市,上久堅,8166-3他,,35.459639,137.870952,,,,,,,,,1,区域,,久堅神社,1972-05-11,,,,,,,旧族知久氏の居城で、峻嶮な山城である。天文23年（1554）に武田氏の下伊那侵攻により落城した。,,,,https://www.city.iida.lg.jp/site/bunkazai/shiteijoukyou.html,
202053,BB2020530154,長野県飯田市,白隠石,ハクインセキ,,,市指定史跡,,,202053,61000,長野県飯田市竹佐345-1,長野県,飯田市,竹佐,345-1,,35.467993,137.762125,,,,,,,,3950242,1,基,,竹佐区,1972-11-02,,,,,,,宝暦7年(1757)に白隠禅師が73歳で当地方を訪れた際に、山本地区の村人の要請により自然石に揮毫された立派なもの。,,,,https://www.city.iida.lg.jp/site/bunkazai/shiteijoukyou.html,
202053,BB2020530155,長野県飯田市,下茶屋の道標,シモチャヤノドウヒョウ,,,市指定史跡,,,202053,21000,長野県飯田市鼎下茶屋994-6,長野県,飯田市,鼎下茶屋,994-6,,35.508952,137.831075,,,,,,,,3950802,1,基,2000020202053 ,飯田市,1985-06-20,,,,,,,宝暦10年（1760）に設置｡遠州街道と伊久間街道の分岐点で秋葉街道の方向を示している。,,,,https://www.city.iida.lg.jp/site/bunkazai/shiteijoukyou.html,
202053,BB2020530156,長野県飯田市,八幡の道標,ヤワタノドウヒョウ,,,市指定史跡,,,202053,131000,長野県飯田市松尾八幡町1971-1,長野県,飯田市,松尾八幡町,1971-1,,35.496102,137.838463,,,,,,,,3950814,1,基,,八幡区,1985-06-20,,,,,,,宝暦10年（1760）に設置｡下条街道と秋葉街道の分岐点である鳩ヶ嶺八幡宮前に位置する。,,,,https://www.city.iida.lg.jp/site/bunkazai/shiteijoukyou.html,
202053,BB2020530157,長野県飯田市,遠山土佐守一族墓碑,トオヤマトサノカミイチゾクボヒ,,,市指定史跡,,龍淵寺,202053,124000,長野県飯田市南信濃和田1198,長野県,飯田市,南信濃和田,1198,,35.321329,137.935293,,,,,,,,3991311,1,区画,,,1988-06-01,,,,,,,龍淵寺境内にある遠山一族の墓所で、土佐守景直とその子加兵衛景重の墓碑がある。,,,,https://www.city.iida.lg.jp/site/bunkazai/shiteijoukyou.html,
202053,BB2020530158,長野県飯田市,知久平城跡,チクダイラジョウアト,,,市指定史跡,,,202053,,長野県飯田市下久堅知久平714－2他,長野県,飯田市,下久堅知久平,714－2他,,35.477953,137.849692,,,,,,,,,1,区域,,個人,1996-10-29,,,,,,,神之峰に移る前の知久氏居城の平山城。天正十年代に徳川家臣菅沼氏が普請し、その縄張が反映されている。,,,,https://www.city.iida.lg.jp/site/bunkazai/shiteijoukyou.html,
202053,BB2020530159,長野県飯田市,青崩峠,アオクズレトウゲ,,,市指定史跡,,,202053,,長野県飯田市南信濃八重河内,長野県,飯田市,南信濃八重河内,,,35.254071,137.910928,,,,,,,,,1,,,林野庁,1999-12-22,,,,,,,信濃と遠江の国境にある峠で、秋葉街道の往時の姿をわずかにとどめる。,,,,https://www.city.iida.lg.jp/site/bunkazai/shiteijoukyou.html,
202053,BB2020530160,長野県飯田市,水佐代獅子塚古墳,ミサジロシシヅカコフン,,,市指定史跡,,,202053,,長野県飯田市松尾水城3458他,長野県,飯田市,松尾水城,3458他,,35.499912,137.846841,,,,,,,,,1,基,,個人,2000-11-12,,,,,,,墳丘の全長約60ｍの前方後円墳であり、前方部西側と後円部北東側の一部が削られている。5世紀後半の築造と考えられる。墳丘の一部が市史跡に指定されている。,,,,https://www.city.iida.lg.jp/site/bunkazai/shiteijoukyou.html,
202053,BB2020530161,長野県飯田市,風越山白山社奥社境内地,カザコシヤマハクサンシャオクシャケイダイチ,,,市指定史跡,,風越山山頂,202053,,長野県飯田市,長野県,飯田市,,,,35.548962,137.78752,,,,,,,,,1,区画,,白山社・丸山享保会生産森林組合,2003-12-25,,,,,,,風越山は古来より信仰の対象で、山頂付近（約1490m）に建立された白山社奥社と参道周辺には神仏習合の石造物等が点在している。,,,,https://www.city.iida.lg.jp/site/bunkazai/shiteijoukyou.html,
202053,BB2020530162,長野県飯田市,畦地１号古墳,アゼチ１ゴウコフン,,,市指定史跡,,,202053,43000,長野県飯田市座光寺3296-4,長野県,飯田市,座光寺,3296-4,,35.538037,137.862453,,,,,,,,3950001,1,基,,個人,2008-11-18,,,,,,,南北方向19.8m・高さ5.5 mの円墳で、6世紀前半の築造。横穴式石室や出土遺物から朝鮮半島からの影響が考えられる。,,,,https://www.city.iida.lg.jp/site/bunkazai/shiteijoukyou.html,
202053,BB2020530163,長野県飯田市,羽場の大柊,ハバノオオヒイラギ,,,市指定天然記念物,,,202053,97003,長野県飯田市羽場町三丁目18-6,長野県,飯田市,羽場町３丁目,18-6,,35.516768,137.803789,,,,,,,,3950063,1,本,,,1968-11-19,,,,,,,モクセイ科の常緑広葉樹で、本件は胸高周囲3.4m、中央自動車道建設に伴い昭和45年4月10日に現在の位置に移植された。,,,,https://www.city.iida.lg.jp/site/bunkazai/shiteijoukyou.html,
202053,BB2020530164,長野県飯田市,龍江大屋敷のイワテヤマナシ,タツエオオヤシキノイワテヤマナシ,,,市指定天然記念物,,,202053,63000,長野県飯田市龍江9637-1,長野県,飯田市,龍江,9637-1,,35.43853,137.859569,,,,,,,,3992221,1,本,,,1971-03-15,,,,,,,東北地方原産の北方種で、南限として貴重なものである。胸高周囲2.6m、樹高15mにおよぶ。,,,,https://www.city.iida.lg.jp/site/bunkazai/shiteijoukyou.html,
202053,BB2020530165,長野県飯田市,正永寺原の公孫樹,ショウエイジバラノイチョウ,,,市指定天然記念物,,,202053,53002,長野県飯田市正永町二丁目1499-3,長野県,飯田市,正永町２丁目,1499-3,,35.526353,137.798764,,,,,,,,3950061,1,本,,個人,1972-05-11,,,,,,,中国が原産で、薬用として伝来したとされる。本件は胸高周囲5.8m、樹高40mので、かつての正永寺境内にある。,,,,https://www.city.iida.lg.jp/site/bunkazai/shiteijoukyou.html,
202053,BB2020530166,長野県飯田市,愛宕神社の清秀桜,アタゴジンジャノセイシュウザクラ,,,市指定天然記念物,,愛宕神社,202053,3000,長野県飯田市愛宕町2781,長野県,飯田市,愛宕町,2781,,35.512676,137.823104,,,,,,,,3950036,1,本,,愛宕稲荷神社,1973-12-25,,,,,,,清秀法印が仁治年間（鎌倉時代）に手植したとされる。胸高周囲6m、樹高約10 mの紅彼岸桜で、当地方で最古と考えられる。,,,,https://www.city.iida.lg.jp/site/bunkazai/shiteijoukyou.html,
202053,BB2020530167,長野県飯田市,鳥屋同志のカヤの木　　,トリヤドウシノカヤノキ　　,,,市指定天然記念物,,旭ケ丘中学校,202053,13000,長野県飯田市大瀬木3530,長野県,飯田市,大瀬木,3530,,35.490466,137.780369,,,,,,,,3950157,1,本,2000020202053 ,飯田市,1985-06-20,,,,,,,イチイ科の常緑針葉樹で、種子は食用になる。本件は旭ヶ丘中学校敷地内にあり、胸高周囲4.0m、樹高20mの巨木である。,,,,https://www.city.iida.lg.jp/site/bunkazai/shiteijoukyou.html,
202053,BB2020530168,長野県飯田市,鼎一色の大杉,カナエイッシキノオオスギ,,,市指定天然記念物,,一色諏訪神社,202053,17000,長野県飯田市鼎一色15,長野県,飯田市,鼎一色,15,,35.504524,137.810849,,,,,,,,3950805,1,本,,一色諏訪神社,1985-06-20,,,,,,,スギ科の日本固有種で、本件は一色神社の社叢中にあり、胸高周囲約4.9m、樹高40mの大木である。,,,,https://www.city.iida.lg.jp/site/bunkazai/shiteijoukyou.html,
202053,BB2020530169,長野県飯田市,遠山土佐守一族墓碑裏方杉の木,トオヤマトサノカミイチゾクボヒウラカタスギノキ,,,市指定天然記念物,,龍淵寺,202053,124000,長野県飯田市南信濃和田1198,長野県,飯田市,南信濃和田,1198,,35.321329,137.935293,,,,,,,,3991311,4,本,,,1988-06-01,,,,,,,龍淵寺境内にある遠山一族の墓所裏手にある杉の老木である。4本の巨木が並んでそびえている。樹高約50ｍ。,,,,https://www.city.iida.lg.jp/site/bunkazai/shiteijoukyou.html,
202053,BB2020530170,長野県飯田市,阿弥陀寺のシダレザクラ　　　,アミダジノシダレザクラ　　　,,,市指定天然記念物,,阿弥陀寺,202053,118002,長野県飯田市丸山町二丁目6728,長野県,飯田市,丸山町２丁目,6728,,35.522978,137.808384,,,,,,,,3950077,1,本,,阿弥陀寺,1990-01-17,,,,,,,枝垂れ桜は、枝が柔らかく垂れるサクラの総称。本件は千体仏観音堂前面にあり、胸高周囲4.2m、樹高15.0mで、樹勢･樹形とも良好な古木である。,,,,https://www.city.iida.lg.jp/site/bunkazai/shiteijoukyou.html,
202053,BB2020530171,長野県飯田市,千代のアベマキ,チヨノアベマキ,,,市指定天然記念物,,,202053,71000,長野県飯田市千代1252-2,長野県,飯田市,千代,1252-2,,35.422318,137.875868,,,,,,,,3992222,1,本,,個人,1991-03-15,,,,,,,ブナ科のクヌギに似た落葉広葉樹で、本件は胸高周囲3.9m、樹高約16.0mで、本樹種としては巨木である。,,,,https://www.city.iida.lg.jp/site/bunkazai/shiteijoukyou.html,
202053,BB2020530172,長野県飯田市,嵯峨坂ざぜん草自生地,サガサカザゼンソウジセイチ,,,市指定天然記念物,,,202053,,長野県飯田市下久堅 嵯峨坂,長野県,飯田市,下久堅 嵯峨坂,,,35.471363,137.87633,,,,,,,,,1,地域,,個人,1995-10-18,,,,,,,サトイモ科の多年草で、湿地を好み早春に花をつける。本件は市内最大の自生地で、500株余りが自生する。,,,,https://www.city.iida.lg.jp/site/bunkazai/shiteijoukyou.html,
202053,BB2020530173,長野県飯田市,万古の栃の木,マンゴノトチノキ,,,市指定天然記念物,,,202053,,長野県飯田市千代法全寺万古,長野県,飯田市,千代法全寺万古,,,35.366299,137.909821,,,,,,,,,1,本,,千代財産区,1996-10-29,,,,,,,トチノキ科の落葉高木で、樹高25m、胸高周囲8.7mで、栃の木としては当地方屈指の巨木である。,,,,https://www.city.iida.lg.jp/site/bunkazai/shiteijoukyou.html,
202053,BB2020530174,長野県飯田市,水佐代獅子塚のエドヒガン　　,ミサジロシシヅカノエドヒガン　　,,,市指定天然記念物,,,202053,115000,長野県飯田市松尾水城3457,長野県,飯田市,松尾水城,3457,,35.49996,137.846866,,,,,,,,3950826,1,本,,飯田市松尾水城区,2000-11-22,,,,,,,胸高周囲5.0m、樹高約17mで、市史跡水佐代獅子塚古墳墳丘上にあり、おたちふの桜とも呼ばれる。,,,,https://www.city.iida.lg.jp/site/bunkazai/shiteijoukyou.html,
202053,BB2020530175,長野県飯田市,黄梅院の紅しだれ桜　　,オウバイインノベニシダレザクラ　　,,,市指定天然記念物,,黄梅院,202053,9003,長野県飯田市江戸町三丁目251,長野県,飯田市,江戸町３丁目,251,,35.516869,137.832168,,,,,,,,3950015,1,本,,黄梅院,2000-11-22,,,,,,,胸高周囲5.5m、樹高約18mで、紅色の濃い花に特徴がある。,,,,https://www.city.iida.lg.jp/site/bunkazai/shiteijoukyou.html,
202053,BB2020530176,長野県飯田市,毛賀くよとのシダレザクラ　　,ケガクヨトノシダレザクラ　　,,,市指定天然記念物,,,202053,40000,長野県飯田市毛賀685,長野県,飯田市,毛賀,685,,35.489158,137.834566,,,,,,,,3950813,1,本,,毛賀諏訪神社,2000-11-22,,,,,,,胸高周囲3.8m、樹高約15mで、その名称は供養塔からの転訛と考えられる。,,,,https://www.city.iida.lg.jp/site/bunkazai/shiteijoukyou.html,
202053,BB2020530177,長野県飯田市,浅間塚の一本杉　　,センゲンヅカノイッポンスギ　　,,,市指定天然記念物,,,202053,30000,長野県飯田市上郷黒田4233,長野県,飯田市,上郷黒田,4233,,35.542708,137.832165,,,,,,,,3950004,1,本,,,2002-07-12,,,,,,,胸高周囲4.2m、樹高約22mで、表日本型の杉樹形を顕著に示している。,,,,https://www.city.iida.lg.jp/site/bunkazai/shiteijoukyou.html,
202053,BB2020530178,長野県飯田市,立石寺前のシダレザクラ,リッシャクジマエノシダレザクラ,,,市指定天然記念物,,,202053,64000,長野県飯田市立石97-5,長野県,飯田市,立石,97-5,,35.431299,137.784896,,,,,,,,3992433,1,本,,個人,2003-12-25,,,,,,,胸高周囲3.5ｍ、樹高8ｍの老木ではあるが、春先には美しい花をつける。,,,,https://www.city.iida.lg.jp/site/bunkazai/shiteijoukyou.html,
202053,BB2020530179,長野県飯田市,風折のエノキ,カザオレノエノキ,,,市指定天然記念物,,,202053,,長野県飯田市上村 風折,長野県,飯田市,上村 風折,,,35.394303,137.976917,,,,,,,,,1,本,,個人,2008-03-25,,,,,,,ニレ科の落葉高木で、胸高周囲5.6ｍと市内では巨樹であり、岩上に生えているため根が板状に発達している。,,,,https://www.city.iida.lg.jp/site/bunkazai/shiteijoukyou.html,
202053,BB2020530180,長野県飯田市,丸山の早生赤梨,マルヤマノワセアカナシ,,,市指定天然記念物,,,202053,60000,長野県飯田市滝の沢6994,長野県,飯田市,滝の沢,6994,,35.527658,137.80842,,,,,,,,3950048,3,本,,個人,2009-03-23,,,,,,,推定樹齢約120年で、梨の栽培樹としては伊那谷で最も古く、飯田下伊那の梨栽培の原点となった梨の木である。2017年3月10日に追加指定あり。,,,,https://www.city.iida.lg.jp/site/bunkazai/shiteijoukyou.html,
202053,BB2020530181,長野県飯田市,麻績の里舞台桜,オミノサトブタイザクラ,,,市指定天然記念物,,,202053,43000,長野県飯田市座光寺2535,長野県,飯田市,座光寺,2535,,35.533202,137.854028,,,,,,,,3950001,1,本,2000020202053 ,飯田市,2011-03-22,,,,,,,樹高12ｍ、幹周4ｍのエドヒガンの枝変りの枝垂桜で、花弁数が不安定で5から10枚の変異がある。,,,,https://www.city.iida.lg.jp/site/bunkazai/shiteijoukyou.html,
202053,BB2020530182,長野県飯田市,風越山山頂のブナ林・ミズナラ・イワウチワ等の自生地及び花崗岩露頭,カザコシヤマサンチョウノブナリン・ミズナラ・イワウチワトウノジセイチオヨビカコウガンロトウ,,,市指定天然記念物,,風越山山頂,202053,,長野県飯田市風越山山頂,長野県,飯田市,風越山山頂,,,,,,,,,,,,,1,地域,,白山社・丸山享保会生産森林組合,2003-12-25,,,,,,,風越山頂に残るブナ林とミズナラの混生林で、植林が進み市内でもブナ林は少ない他、イワウチワ等希少種の自生地であり、また花崗岩の巨石が造る風穴がある。,,,,https://www.city.iida.lg.jp/site/bunkazai/shiteijoukyou.html,
202053,BB2020530183,長野県飯田市,ギフチョウ【卵､幼虫､さなぎ､成虫】,ギフチョウ【タマゴ､ヨウチュウ､サナギ､セイチュウ】,,,市指定天然記念物,,,202053,,長野県飯田市,長野県,飯田市,,,,,,,,,,,,,,1,種,,,1989-01-31,,,,,,,アゲハチョウ科の日本固有種で、桜の咲く頃に出現する。幼虫はヒメカンアオイ・ウスバサイシンを食す。市内生息のギフチョウは翅紋の黒帯が広いという形態的な特徴がある。,,,,https://www.city.iida.lg.jp/site/bunkazai/shiteijoukyou.html,
202053,BB2020530184,長野県飯田市,中央構造線程野露頭,チュウオウコウゾウセンホドノロトウ,,,市指定天然記念物,,,202053,34000,長野県飯田市上村16-47,長野県,飯田市,上村,16-47,,35.442664,137.996264,,,,,,,,3991403,1,区域,,個人,2018-12-14,,,,,,,中央構造線の露頭で、水平・垂直方向の断層のずれを確認することができる。破砕帯の状況は活断層であることを示している。,,,,https://www.city.iida.lg.jp/site/bunkazai/shiteijoukyou.html,
202053,BB2020530185,長野県飯田市,中郷流宮岩,ナカゴウナガレミヤノイワ,,,市指定天然記念物,,,202053,34000,長野県飯田市上村413-3,長野県,飯田市,上村,413-3,,35.407212,137.974267,,,,,,,,3991403,1,個,,個人,2018-12-14,,,,,,,御池山付近から崩落してきた巨大な岩塊で、褶曲構造をはっきりと確認することができる。2億年以上前に遠洋で堆積した地層が、3000ｍ級の赤石山脈に成長する過程を観察することができる。,,,,https://www.city.iida.lg.jp/site/bunkazai/shiteijoukyou.html,
202053,BB2020530186,長野県飯田市,立石寺立石柿絵馬,リッシャクジタテイシガキエマ,,,市指定民俗文化財,,立石寺,202053,64000,長野県飯田市立石140,長野県,飯田市,立石,140,,35.432062,137.784363,,,,,,,,3992433,2,点,,立石寺,2022-12-14,,,,,,,現在も地域の特産品である干柿や果樹栽培の源流や、天竜川を利用した物資輸送の様子や周辺の地勢の様子が描きだされている貴重な絵画史料である。立石寺所蔵。,,,,https://www.city.iida.lg.jp/site/bunkazai/shiteijoukyou.html,
