202053,BB2020530048,長野県飯田市,下伊那出土の富本銭、和同開珎銀銭,シモイナシュツドノフホンセン、ワドウカイチンギンセン,,,県宝,,飯田市美術博物館,202053,11002,長野県飯田市追手町二丁目655-7,長野県,飯田市,追手町２丁目,655-7,,35.512008,137.830531,,,,,,,,3950034,2,枚,,,2000-03-27,,09：30,17：00,入館受付は16:30で終了;月曜日（祝日の場合は開館）、祝日の翌日、年末年始、その他に展示替え等で臨時休館する場合があります。HP等で公開されている休館日カレンダーをご確認ください。,,,天武12年（683）鋳造の我が国最古の貨幣である富本銭と和銅元年（708）鋳造された和同銀銭で、当地方が大和朝廷との深い関係にあったことを示す貴重な資料である。,,,,https://www.city.iida.lg.jp/site/bunkazai/shiteijoukyou.html,
202053,BB2020530049,長野県飯田市,平沢文書,ヒラサワモンジョ,,,県宝,,飯田市美術博物館,202053,11002,長野県飯田市追手町二丁目655-7,長野県,飯田市,追手町２丁目,655-7,,35.512008,137.830531,,,,,,,,3950034,3800,点,,,2004-03-29,,,,,,,戦国時代から江戸時代にかけて下久堅北原の庄屋平沢家に代々伝わった古文書で、村人の生活の様子や行政担当者の資料が一括で残っている。,,,,https://www.city.iida.lg.jp/site/bunkazai/shiteijoukyou.html,
202053,BB2020530050,長野県飯田市,絹本著色菊慈童,ケンポンチャクショクキクジドウ,,,県宝,,飯田市美術博物館,202053,11002,長野県飯田市追手町二丁目655-7,長野県,飯田市,追手町２丁目,655-7,,35.512008,137.830531,,,,,,,,3950034,1,点,2000020202053 ,飯田市,2007-05-01,,,,展示予定は美術博物館にお問い合わせください。,,,明治33年（1900）菱田春草26才の作で、日本画の革新を目指した朦朧体画風の代表作である。日本美術院の絵画共進会に出品した大作である。,,,,https://www.city.iida.lg.jp/site/bunkazai/shiteijoukyou.html,
202053,BB2020530051,長野県飯田市,木造大鑑禅師坐像,モクゾウダイカンゼンジザゾウ,,,県宝,,,202053,28000,長野県飯田市上川路1000,長野県,飯田市,上川路,1000,,35.462313,137.814791,,,,,,,,3992564,1,体,,開善寺,2010-10-12,,,,,,,禅僧清拙正澄の坐像で、高さ72㎝のヒノキの寄せ木造りで、表面の文様などから鎌倉・南北朝時代の作と推定される。,,,,https://www.city.iida.lg.jp/site/bunkazai/shiteijoukyou.html,
202053,BB2020530052,長野県飯田市,阿弥陀如来坐像,アミダニョライザゾウ,,,県宝,,,202053,126001,長野県飯田市箕瀬町一丁目2464-1,長野県,飯田市,箕瀬町一丁目,2464-1,,35.514840,137.819187,,,,,,,,3950054,1,体,,,1949-02-18,,,,,,,像高51.8cmの木造漆箔の像で、鎌倉時代前半期の作とされる。運慶・快慶の流派である慶派仏師の作風の影響を受けている。,,,,https://www.city.iida.lg.jp/site/bunkazai/shiteijoukyou.html,
202053,BB2020530053,長野県飯田市,御猿堂古墳,オサルドウコフン,,,県指定史跡,,,202053,,長野県飯田市上川路884-2他,長野県,飯田市,上川路,884-2他,,35.461612,137.812408,,,,,,,,,1,基,,個人,1969-07-03,,,,,,,墳丘の全長65.4ｍ、横穴式石室を有する前方後円墳である。墳丘の大半が国史跡に指定されている。,,,,https://www.city.iida.lg.jp/site/bunkazai/shiteijoukyou.html,
202053,BB2020530054,長野県飯田市,鈴岡城跡,スズオカジョウアト,,,史跡,,,202053,,長野県飯田市駄科1729他,長野県,飯田市,駄科,1729他,,35.483695,137.826226,,,,,,,,,1,区域,,駄科区他,1971-05-27,,,,,,,段丘突端の平山城。室町時代、小笠原氏は家督を巡り一族内で争った。鈴岡城はその一派が拠った城で、松尾城主などと対立した。,,,,https://www.city.iida.lg.jp/site/bunkazai/shiteijoukyou.html,
202053,BB2020530055,長野県飯田市,松尾城跡,マツオジョウアト,,,史跡,,,202053,,長野県飯田市松尾代田1006他,長野県,飯田市,松尾代田,1006他,,35.486979,137.828229,,,,,,,,,1,区域,,飯田市他,1972-10-16,,,,,,,段丘突端の平山城。室町時代、信濃守護職松尾小笠原氏の本拠地として信濃・伊那の中心であった。,,,,https://www.city.iida.lg.jp/site/bunkazai/shiteijoukyou.html,
202053,BB2020530056,長野県飯田市,代田山狐塚古墳,シロタヤマキツネヅカコフン,,,史跡,,,202053,110000,長野県飯田市松尾代田1403-71,長野県,飯田市,松尾代田,1403-71,,35.49187,137.835518,,,,,,,,3950812,1,基,,八幡社,1994-02-16,,,,,,,全長42ｍの前方後方墳で、4世紀代の築造と考えられる。大和王権より一足早くに東海地方勢力の影響があったことが示唆される。,,,,https://www.city.iida.lg.jp/site/bunkazai/shiteijoukyou.html,
202053,BB2020530057,長野県飯田市,南本城城跡,ミナミホンジョウジョウアト,,,史跡,,,202053,43000,長野県飯田市座光寺1849他,長野県,飯田市,座光寺,1849ほか,,35.535647,137.85225,,,,,,,,3950001,1,区域,,飯田市座光寺地区財産区他,2013-03-25,,,,,,,大規模で複雑な縄張の山城。保存状態が大変良い。文献はないが、座光寺氏の他、戦国大名の関与が考えられる。,,,,https://www.city.iida.lg.jp/site/bunkazai/shiteijoukyou.html,
202053,BB2020530058,長野県飯田市,座光寺の石川除,ザコウジノイシカワヨケ,,,史跡,,,202053,43000,長野県飯田市座光寺6710-2他,長野県,飯田市,座光寺,6710-2ほか,,35.530274,137.871316,,,,,,,,3950001,1,区域,,飯田市　個人,2018-09-27,,,,,,,文政11年（1828）～天保2年（1831）に、天竜川と南大島川の合流点に築かれた石積みの堤防で、治水利水の様子をよく伝えている。,,,,https://www.city.iida.lg.jp/site/bunkazai/shiteijoukyou.html,
202053,BB2020530059,長野県飯田市,モリアオガエル繁殖地,モリアオガエルハンショクチ,,,県指定天然記念物,動物,,202053,30000,長野県飯田市上郷黒田3481,長野県,飯田市,上郷黒田,3481,,35.575253,137.804204,,,,,,,,3950004,1,区域,2000020202053 ,飯田市,1968-05-16,,,,,,,日本固有種のアオガエル科の繁殖地。カエルの仲間では唯一樹上に産卵し、5月から7月にかけて泡状の卵塊を池の上の枝に産みつける。,,,,https://www.city.iida.lg.jp/site/bunkazai/shiteijoukyou.html,
202053,BB2020530060,長野県飯田市,ベニヒカゲ,ベニヒカゲ,,,県指定天然記念物,動物,,202053,,,長野県,飯田市,,,,,,,,,,,,,,1,種,,,1975-02-24,,,,,,,ジャノメチョウ科の高山蝶で、市内では木曽山脈、赤石山脈で確認される。,,,,https://www.city.iida.lg.jp/site/bunkazai/shiteijoukyou.html,
202053,BB2020530061,長野県飯田市,クモマベニヒカゲ,クモマベニヒカゲ,,,県指定天然記念物,動物,,202053,,,長野県,飯田市,,,,,,,,,,,,,,1,種,,,1975-02-24,,,,,,,ベニヒカゲと近縁の高山蝶で、木曽・赤石山脈では主としてダケカンバ帯の林間の草地などに生息している。,,,,https://www.city.iida.lg.jp/site/bunkazai/shiteijoukyou.html,
202053,BB2020530062,長野県飯田市,クモマツマキチョウ,クモマツマキチョウ,,,県指定天然記念物,動物,,202053,,,長野県,飯田市,,,,,,,,,,,,,,1,種,,,1975-02-24,,,,,,,シロチョウ科の高山蝶で、中部山岳地域に生息し、赤石山脈では中腹の沢沿いに分布する。,,,,https://www.city.iida.lg.jp/site/bunkazai/shiteijoukyou.html,
202053,BB2020530063,長野県飯田市,ミヤマシロチョウ,ミヤマシロチョウ,,,県指定天然記念物,動物,,202053,,,長野県,飯田市,,,,,,,,,,,,,,1,種,,,1975-02-24,,,,,,,シロチョウ科の高山蝶で、亜高山帯に生息し、伊那谷では赤石山脈の中腹に広く分布するが、絶滅が危惧される。,,,,https://www.city.iida.lg.jp/site/bunkazai/shiteijoukyou.html,
202053,BB2020530064,長野県飯田市,オオイチモンジ,オオイチモンジ,,,県指定天然記念物,動物,,202053,,,長野県,飯田市,,,,,,,,,,,,,,1,種,,,1975-02-24,,,,,,,タテハチョウ科の高山蝶で、本州中部と北海道に分布するが、本州では局所的で、赤石山脈にもわずかに記録がある。現在の生息状況は不明である。,,,,https://www.city.iida.lg.jp/site/bunkazai/shiteijoukyou.html,
202053,BB2020530065,長野県飯田市,ホンシュウモモンガ,ホンシュウモモンガ,,,県指定天然記念物,動物,,202053,,,長野県,飯田市,,,,,,,,,,,,,,1,種,,,1975-11-05,,,,,,,日本特産のリス科の小動物で、本州･四国･九州に分布し、市内の山間部に広く分布していたが、近年激減している。,,,,https://www.city.iida.lg.jp/site/bunkazai/shiteijoukyou.html,
202053,BB2020530066,長野県飯田市,ホンドオコジョ,ホンドオコジョ,,,県指定天然記念物,動物,,202053,,,長野県,飯田市,,,,,,,,,,,,,,1,種,,,1975-11-05,,,,,,,イタチ科の小動物で、中部地方以北の山岳地帯に生息し、伊那谷では木曽・赤石山脈の主として亜高山帯以上の地域に生息する。,,,,https://www.city.iida.lg.jp/site/bunkazai/shiteijoukyou.html,
202053,BB2020530067,長野県飯田市,ブッポウソウ,ブッポウソウ,,,県指定天然記念物,動物,,202053,,,長野県,飯田市,,,,,,,,,,,,,,1,種,,,1985-07-29,,,,,,,ブッポウソウ科の鳥で、東南アジア地域から、夏鳥として渡来する。飯田市では遠山谷で確認されている。,,,,https://www.city.iida.lg.jp/site/bunkazai/shiteijoukyou.html,
202053,BB2020530068,長野県飯田市,山本のハナノキ,ヤマモトノハナノキ,,,県指定天然記念物,植物,,202053,130000,長野県飯田市山本6771,長野県,飯田市,山本,6771,,35.489111,137.76227,,,,,,,,3950244,1,本,,個人等,1965-04-30,,,,,,,カエデ科、雌雄異株の日本固有種で、生存環境が限られる。本件は分布北限に位置する樹高30m、胸高周囲4.8mある大木である。,,,,https://www.city.iida.lg.jp/site/bunkazai/shiteijoukyou.html,
202053,BB2020530069,長野県飯田市,長姫のエドヒガン,オサヒメノエドヒガン,,,県指定天然記念物,植物,飯田市美術博物館,202053,11002,長野県飯田市追手町二丁目655-7,長野県,飯田市,追手町２丁目,655-7,,35.512257,137.830823,,,,,,,,3950034,1,本,2000020202053 ,飯田市,1967-05-22,,,,,,,エドヒガンは他の桜より一足早く咲く。本件は樹高20m、胸高周囲5.4mで、幹が雄々しい。飯田藩家老安富家にちなんで「安富桜」ともよばれる。,,,,https://www.city.iida.lg.jp/site/bunkazai/shiteijoukyou.html,
202053,BB2020530070,長野県飯田市,川路のネズミサシ,カワジノネズミサシ,,,県指定天然記念物,植物,,202053,35000,長野県飯田市川路4693,長野県,飯田市,川路,4693,,35.440828,137.815531,,,,,,,,3992431,1,本,,,1968-03-21,,,,,,,ヒノキ科の針葉樹で、本件は樹高18m、胸高周囲3.5mの直立した樹形であり、この種では県内で随一の大木である。,,,,https://www.city.iida.lg.jp/site/bunkazai/shiteijoukyou.html,
202053,BB2020530071,長野県飯田市,風越山のベニマンサクの自生地,カザコシヤマノベニマンサクノジセイチ,,,県指定天然記念物,植物,,202053,,長野県飯田市上飯田6999他,長野県,飯田市,上飯田,6999他,,35.542319,137.798966,,,,,,,,,1,地域,,丸山享保会生産森林組合,1968-05-16,,,,,,,マンサク科の日本固有種の自生地。標高600m～1400mに群生する。暖地性の植物で分布の東北限にあたる。,,,,https://www.city.iida.lg.jp/site/bunkazai/shiteijoukyou.html,
202053,BB2020530072,長野県飯田市,立石の雄スギ雌スギ,タテイシノオスギメスギ,,,県指定天然記念物,植物,,202053,64000,長野県飯田市立石502、659,長野県,飯田市,立石,502、659,,35.429493,137.784051,,,,,,,,3992433,2,本,,立石区　個人,1968-05-16,,,,,,,地区の中央に約400m離れてそびえる杉の巨木で、胸高周囲は、雄スギ9.8m、雌スギ9.0m。樹高は雄スギ44.5m、雌スギ44.0mにのぼる。,,,,https://www.city.iida.lg.jp/site/bunkazai/shiteijoukyou.html,
202053,BB2020530073,長野県飯田市,飯田城桜丸のイスノキ,イイダジョウサクラノマルノイスノキ,,,県指定天然記念物,植物,長野県飯田合同庁舎敷地内,202053,,長野県飯田市長野県飯田合同庁舎敷地内,長野県,飯田市,,,長野県飯田合同庁舎敷地内,35.513233,137.830194,,,,,,,,,1,本,,長野県,2014-09-25,,,,,,,伊豆地方以南に自生するマンサク科の常緑高木で、暖地性だが旧飯田城桜丸に残されており、大変に珍しい。,,,,https://www.city.iida.lg.jp/site/bunkazai/shiteijoukyou.html,
202053,BB2020530074,長野県飯田市,三石の甌穴群,ミツイシノオウケツグン,,,県指定天然記念物,地質,,202053,,長野県飯田市下久堅知久平690他,長野県,飯田市,下久堅知久平,690他,,35.479755,137.850516,,,,,,,,,1,,,,1976-03-29,,,,,,,川底や川岸の岩盤にできた円形の穴で、往時の天竜川の河蝕作用とその後の地盤隆起等を示す地学上の貴重な資料である。,,,,https://www.city.iida.lg.jp/site/bunkazai/shiteijoukyou.html,
202053,BB2020530075,長野県飯田市,遠山川の埋没林と埋没樹,トオヤマガワノマイボツリントマイボツジュ,,,県指定天然記念物,地質・鉱物,,202053,,長野県飯田市南信濃小道木・大島ほか,長野県,飯田市,南信濃小道木・大島ほか,,,35.337557,137.949454,,,,,,,,,2,区域・本,,長野県　飯田市,2019-10-24,,,,,,,奈良時代に発生した遠江地震に伴う土砂崩れにより、遠山川に天然ダムが作られ、土石とともにダム内の土砂に混じった倒木が埋没樹、ダム湖沿いの原生林が水没・埋没したものが埋没林となった。古代の災害のようすを今に伝えている。,,,,https://www.city.iida.lg.jp/site/bunkazai/shiteijoukyou.html,
202053,BB2020530076,長野県飯田市,味の文化財,アジノブンカザイ,,,県選択無形民俗文化財,,,202053,,長野県内一円,長野県,,,,,,,,,,,,,,,1,,,,1983-07-13,,,,,,,手打ちそば、御幣餅、野沢菜漬け他、長野県における伝統的な食文化の代表事例である。,,,,https://www.city.iida.lg.jp/site/bunkazai/shiteijoukyou.html,
202053,BB2020530077,長野県飯田市,飯田市伊豆木の鯖鮨,イイダシイズキノサバズシ,,,県選択無形民俗文化財,,,202053,,長野県飯田市伊豆木,長野県,飯田市,伊豆木,,,35.443429,137.79247,,,,,,,,,1,,,,2000-03-15,,,,,,,10月7日の八幡宮祭典に奉納される姿鮨と家庭で食べられるチラシ鮨がある。伊豆木小笠原初代長巨が上方に出陣した際の兵糧食といわれる。,,,,https://www.city.iida.lg.jp/site/bunkazai/shiteijoukyou.html,
202053,BB2020530078,長野県飯田市,南信州の柚餅子,ミナミシンシュウノユベシ,,,県選択無形民俗文化財,,,202053,,長野県飯田市南信濃他,長野県,飯田市,南信濃他,,,,,,,,,,,,,1,,,,2000-03-15,,,,,,,味噌・米粉・うどん粉・砂糖・クルミなどをまぜ、柚子の実の汁を加えて蒸した菓子である。,,,,https://www.city.iida.lg.jp/site/bunkazai/shiteijoukyou.html,
202053,BB2020530079,長野県飯田市,木曽の朴葉巻・下伊那南部の朴葉餅,キソノホオバマキ・シモイナナンブノホオバモチ,,,県選択無形民俗文化財,,,202053,,長野県飯田市上村他,長野県,飯田市,上村他,,,,,,,,,,,,,1,,,,2001-03-15,,,,,,,米の粉を捏ねた皮で小豆の餡を包み、朴の葉でくるんで蒸し上げたもの。,,,,https://www.city.iida.lg.jp/site/bunkazai/shiteijoukyou.html,
202053,BB2020530080,長野県飯田市,遠山郷の二度芋の味噌田楽,トオヤマゴウノニドイモノミソデンガク,,,県選択無形民俗文化財,,,202053,,長野県飯田市上村・南信濃,長野県,飯田市,上村・南信濃,,,,,,,,,,,,,1,,,,2002-03-15,,,,,,,二度芋はじゃがいもの在来種で、甘味があり、煮物などに使っても煮崩れしない。これを味噌田楽にし炭火であぶった郷土食である。,,,,https://www.city.iida.lg.jp/site/bunkazai/shiteijoukyou.html,
202053,BB2020530081,長野県飯田市,菱田春草の「白き猫」,ヒシダシュンソウノ「シロキネコ」,,,市指定有形文化財,絵画,飯田市美術博物館,202053,11002,長野県飯田市追手町二丁目655-7,長野県,飯田市,追手町２丁目,655-7,,35.512008,137.830531,,,,,,,,3950034,1,幅,,春草会,1968-08-21,,,,展示予定は美術博物館にお問い合わせください。,,,春草27才の作品で、明治34年（1901）の帰郷後に東京へ戻り、１か月後に完成させて春草が母校へ寄贈した。,,,,https://www.city.iida.lg.jp/site/bunkazai/shiteijoukyou.html,
202053,BB2020530082,長野県飯田市,絹本著色聖徳太子絵伝,ケンポンチャクショクショウトクタイシエデン,,,市指定有形文化財,絵画,飯田市美術博物館,202053,11002,長野県飯田市追手町二丁目655-7,長野県,飯田市,追手町２丁目,655-7,,35.512008,137.830531,,,,,,,,3950034,5,幅,2000020202053 ,飯田市,2007-08-21,,,,,,,鎌倉末～南北朝時代の製作で、宮ノ上太子堂に伝来した。損傷は大きいが聖徳太子絵伝の古様を示している。,,,,https://www.city.iida.lg.jp/site/bunkazai/shiteijoukyou.html,
202053,BB2020530083,長野県飯田市,絹本著色阿弥陀如来像,ケンポンチャクショクアミダニョライゾウ,,,市指定有形文化財,絵画,飯田市美術博物館,202053,11002,長野県飯田市追手町二丁目655-7,長野県,飯田市,追手町２丁目,655-7,,35.512008,137.830531,,,,,,,,3950034,1,点,2000020202053 ,飯田市,2008-11-21,,,,,,,室町時代の作とされ、当地方の現存最古例で、全国でも古い作品である。立石の雌杉の下にあった杉の堂に伝来し、その跡地の個人宅に保管された。,,,,https://www.city.iida.lg.jp/site/bunkazai/shiteijoukyou.html,
202053,BB2020530084,長野県飯田市,信濃国飯田城下町絵図,シナノノクニイイダジョウカマチエズ,,,市指定有形文化財,絵画,下伊那教育会,202053,83000,長野県飯田市仲ノ町303-1,長野県,飯田市,仲ノ町,303-1,,35.516205,137.83,,,,,,,,3950021,1,点,7100005009466 ,公益社団法人下伊那教育会,2022-09-20,,,,,,,江戸時代初期脇坂氏藩主時代の飯田城ならびに城下町の姿を薄い彩色で描いた絵図で、堀氏に引き継がれた。,,,,https://www.city.iida.lg.jp/site/bunkazai/shiteijoukyou.html,
202053,BB2020530085,長野県飯田市,信州伊奈郡之絵図,シンシュウイナグンノエズ,,,市指定有形文化財,絵画,飯田市美術博物館,202053,11002,長野県飯田市追手町二丁目655-7,長野県,飯田市,追手町２丁目,655-7,,35.512008,137.830531,,,,,,,,3950034,1,点,2000020202053 ,飯田市,2008-03-25,,,,,,,江戸時代初期正保年間に、江戸幕府が諸国に提出を命じた郡の絵図の副本とみられる。上・下伊那郡の様子を描いた最古で詳細な絵図として貴重。,,,,https://www.city.iida.lg.jp/site/bunkazai/shiteijoukyou.html,
202053,BB2020530086,長野県飯田市,菱田春草筆「武具の図」,ヒシダシュンソウヒツ「ブグノズ」,,,市指定有形文化財,絵画,飯田市美術博物館,202053,11002,長野県飯田市追手町二丁目655-7,長野県,飯田市,追手町２丁目,655-7,,35.512008,137.830531,,,,,,,,3950034,1,面,,春草会,2011-07-20,,,,展示予定は美術博物館にお問い合わせください。,,,東京美術学校時代の作品で、大和絵の伝統を学びながら、写実性があらわれ学習の成果が見える。春草会が最も早くに所蔵した春草作品である。,,,,https://www.city.iida.lg.jp/site/bunkazai/shiteijoukyou.html,
202053,BB2020530087,長野県飯田市,菱田春草筆「霊昭女」,ヒシダシュンソウヒツ「レイショウニョ」,,,市指定有形文化財,絵画,飯田市美術博物館,202053,11002,長野県飯田市追手町二丁目655-7,長野県,飯田市,追手町２丁目,655-7,,35.512008,137.830531,,,,,,,,3950034,1,幅,2000020202053 ,飯田市,2011-07-20,,,,展示予定は美術博物館にお問い合わせください。,,,日本美術院の第16回絵画互評会で二等を受賞した作品で、重文「王昭君」と共通する表現が随所に見られる。,,,,https://www.city.iida.lg.jp/site/bunkazai/shiteijoukyou.html,
202053,BB2020530088,長野県飯田市,菱田春草筆「鹿」,ヒシダシュンソウヒツ「シカ」,,,市指定有形文化財,絵画,飯田市美術博物館,202053,11002,長野県飯田市追手町二丁目655-7,長野県,飯田市,追手町２丁目,655-7,,35.512008,137.830531,,,,,,,,3950034,1,幅,2000020202053 ,飯田市,2011-07-20,,,,展示予定は美術博物館にお問い合わせください。,,,第10回日本美術院連合絵画共進会で銀章となった作品で、写実性に主眼を置く朦朧体後期の画風をよく示す。,,,,https://www.city.iida.lg.jp/site/bunkazai/shiteijoukyou.html,
202053,BB2020530089,長野県飯田市,菱田春草筆「夕の森」,ヒシダシュンソウヒツ「ユウベノモリ」,,,市指定有形文化財,絵画,飯田市美術博物館,202053,11002,長野県飯田市追手町二丁目655-7,長野県,飯田市,追手町２丁目,655-7,,35.512008,137.830531,,,,,,,,3950034,1,幅,2000020202053 ,飯田市,2011-07-20,,,,展示予定は美術博物館にお問い合わせください。,,,滞米期に描かれたことが明確な作品で、春草の米欧遊学期の作風をよく示し、この時期を代表する。,,,,https://www.city.iida.lg.jp/site/bunkazai/shiteijoukyou.html,
202053,BB2020530090,長野県飯田市,菱田春草筆「夜桜」,ヒシダシュンソウヒツ「ヨザクラ」,,,市指定有形文化財,絵画,飯田市美術博物館,202053,11002,長野県飯田市追手町二丁目655-7,長野県,飯田市,追手町２丁目,655-7,,35.512008,137.830531,,,,,,,,3950034,1,幅,2000020202053 ,飯田市,2011-07-20,,,,展示予定は美術博物館にお問い合わせください。,,,美術博物館開館にあわせて、菱田家から飯田市へ寄贈された作品で、滞米期の作品と伝えられている。,,,,https://www.city.iida.lg.jp/site/bunkazai/shiteijoukyou.html,
202053,BB2020530091,長野県飯田市,菱田春草筆「帰樵」,ヒシダシュンソウヒツ「キショウ」,,,市指定有形文化財,絵画,飯田市美術博物館,202053,11002,長野県飯田市追手町二丁目655-7,長野県,飯田市,追手町２丁目,655-7,,35.512008,137.830531,,,,,,,,3950034,1,幅,2000020202053 ,飯田市,2011-07-20,,,,展示予定は美術博物館にお問い合わせください。,,,米欧から帰国後間もなくして描かれた作品で、朦朧体の空間性と鮮やかな色彩が両立し、朦朧体研究の成果が表れる。,,,,https://www.city.iida.lg.jp/site/bunkazai/shiteijoukyou.html,
202053,BB2020530092,長野県飯田市,菱田春草筆「春秋」,ヒシダシュンソウヒツ「シュンジュウ」,,,市指定有形文化財,絵画,飯田市美術博物館,202053,11002,長野県飯田市追手町二丁目655-7,長野県,飯田市,追手町２丁目,655-7,,35.512008,137.830531,,,,,,,,3950034,双,幅,2000020202053 ,飯田市,2011-07-20,,,,展示予定は美術博物館にお問い合わせください。,,,装飾性のある作風が結実し、春草が高い評価を得た時期の作品で、重文「黒き猫」の作風に通ずる。,,,,https://www.city.iida.lg.jp/site/bunkazai/shiteijoukyou.html,
202053,BB2020530093,長野県飯田市,菱田春草筆「鎌倉時代闘牛の図」,ヒシダシュンソウヒツ「カマクラジダイトウギュウノズ」,,,市指定有形文化財,絵画,飯田市美術博物館,202053,11002,長野県飯田市追手町二丁目655-7,長野県,飯田市,追手町２丁目,655-7,,35.512008,137.830531,,,,,,,,3950034,1,幅,2000020202053 ,飯田市,2018-07-18,,,,展示予定は美術博物館にお問い合わせください。,,,東京美術学校時代の作品で、大和絵の伝統を学びながら、写実性があらわれ学習の成果が見える。現存する春草作品の中で最も早い出品受賞作品である。,,,,https://www.city.iida.lg.jp/site/bunkazai/shiteijoukyou.html,
202053,BB2020530094,長野県飯田市,菱田春草筆「富嶽」,ヒシダシュンソウヒツ「フガク」,,,市指定有形文化財,絵画,飯田市美術博物館,202053,11002,長野県飯田市追手町二丁目655-7,長野県,飯田市,追手町２丁目,655-7,,35.512008,137.830531,,,,,,,,3950034,1,幅,2000020202053 ,飯田市,2019-06-12,,,,展示予定は美術博物館にお問い合わせください。,,,朦朧体の画風を示すが、米欧遊学で印象派等の影響を受けた春草が色彩研究を重ね、朦朧体から装飾性重視の画風へと向かう移行期の画風を伝える作品である。,,,,https://www.city.iida.lg.jp/site/bunkazai/shiteijoukyou.html,
